{
  "$schema": "http://json-schema.org/draft-04/schema",
  "type" : "object",
  "properties" : {
    "id" : { "type" : "number" },
    "name" : { "type" : "string", "minLength":1 },
    "description" : { "type" : "string" },
    "location" : { "type" : "string" },
    "starts_at" : { "type" : "string" },
    "ends_at" : { "type" : "string" }
  }
}